<?xml version="1.0" encoding="UTF-8"?>
<!DOCTYPE form PUBLIC "ssh-secsh-auth-form-1.dtd" "ssh-secsh-auth-form-1.dtd">
<form id="password">
<label></label>
<secret ref="password">
<label>%%%USERNAME%%%@%%%SERVERHOST-SERVERPORT%%%'s password</label>
<send submission="ok" />
</secret>
<submit ref="ok" >
<label>OK</label>
</submit>
<submit ref="cancel" >
<label>Cancel</label>
</submit>
</form>
